<?xml version="1.0" encoding="UTF-8"?>
<!--
To change this license header, choose License Headers in Project Properties.
To change this template file, choose Tools | Templates
and open the template in the editor.
-->
<?xml-stylesheet href="menu.css"?>
<!DOCTYPE menu SYSTEM "menu.dtd">
<menu>

    <food>
        <name>Pizza</name>
        <price>50</price>
        <description>macon and cheese</description>
        <portionsize>medium-sized pizzas</portionsize>
    </food>
    <food>
        <name>Gatsby</name>
        <price>55</price>
        <description>chips, polony and steak</description>
        <portionsize>1 foot</portionsize>
    </food>
    
    
</menu>
    
